<?xml version="1.0"?>
<!DOCTYPE Report
[
<!ELEMENT Report (General ,(Doc|BPT)) >
<!ATTLIST Report ver CDATA #REQUIRED tmZone CDATA #REQUIRED>

<!ELEMENT General ( DocLocation ) >
<!ATTLIST General productName CDATA #REQUIRED productVer CDATA #REQUIRED os CDATA #REQUIRED host CDATA #REQUIRED qcserver CDATA #IMPLIED qcproject CDATA #IMPLIED SolManSolutionId CDATA #IMPLIED SolManProjectId CDATA #IMPLIED SolManTestPlanId CDATA #IMPLIED SolManTestPackageId CDATA #IMPLIED SolManUserInfoData CDATA #IMPLIED  >

<!ELEMENT BPT (DName,Res,DVer?,TSet?,TInst?,NodeArgs,AdditionalInfo*,Doc*) >
<!ATTLIST BPT rID ID #REQUIRED >

<!ELEMENT Doc (DName,ConfName?,Res,DVer?,TSet?,TInst?,RunType?,DT?,AdditionalInfo*,Step*,DIter*,Step*,Action*,Doc*,Summary?,TestMaintenanceSummary*,NodeArgs?) >
<!ATTLIST Doc rID ID #REQUIRED type (Test|BC|BPTWrapperTest|Flow|Group|Action) "Test" productName CDATA #REQUIRED BCIter CDATA #IMPLIED >

<!ELEMENT RunType ( #PCDATA )>
<!ATTLIST RunType fmStep (False|True) "False" batch (False|True) "False" upDesc (False|True) "False" upChk (False|True) "False" upAS (False|True) "False">

<!ELEMENT DName ( #PCDATA ) >

<!ELEMENT ConfName ( #PCDATA ) >

<!ELEMENT Res ( #PCDATA ) >

<!ELEMENT AdditionalInfo (AdditionalDataName,AdditionalDataValue ) >

<!ELEMENT AdditionalDataName ( #PCDATA ) >

<!ELEMENT AdditionalDataValue ( #PCDATA ) >

<!ELEMENT DVer ( #PCDATA ) >

<!ELEMENT TSet ( #PCDATA ) >

<!ELEMENT TInst ( #PCDATA ) >

<!ELEMENT DIter (Step*,Action+,Summary?,NodeArgs)>
<!ATTLIST DIter rID ID #REQUIRED iterID CDATA #REQUIRED>

<!ELEMENT DocLocation ( #PCDATA )>

<!ELEMENT Action (AName,AIter*,(Step|HtmlStep|Action)*, Summary,ActionMaintenanceSummary*, NodeArgs ) >
<!ATTLIST Action rID ID #REQUIRED>

<!ELEMENT AIter ((Step|HtmlStep|Action)*,DataMapping?, Summary?,NodeArgs) >
<!ATTLIST AIter rID ID #REQUIRED iterID CDATA #REQUIRED isCountable (False|True) "False" >

<!ELEMENT AName ( #PCDATA ) >

<!ELEMENT TestMaintenanceSummary (ActionMaintenanceSummary*) >
<!ATTLIST TestMaintenanceSummary ObjectsAdded CDATA #REQUIRED ObjectsUpdated CDATA #REQUIRED StepsUpdated CDATA #REQUIRED StepsComments CDATA #REQUIRED><!ELEMENT ActionMaintenanceSummary (ObjectChange* ) >
<!ATTLIST ActionMaintenanceSummary Action CDATA #REQUIRED Objects CDATA #REQUIRED Updated CDATA #REQUIRED LinesTotal CDATA #REQUIRED Added CDATA #REQUIRED LinesUpdated CDATA #REQUIRED>

<!ELEMENT ObjectChange  (Hierarchy, PropertyChangeList* ) >
<!ATTLIST ObjectChange Operation CDATA #IMPLIED OriginalRepository CDATA #IMPLIED>

<!ELEMENT PropertyChangeList (PropertyDef*) >

<!ELEMENT PropertyDef (OriginalValue, NewValue) >
<!ATTLIST PropertyDef PropName CDATA #REQUIRED OriginRegularExpression (True|False) "False" NewRegularExpression (True|False) "False" AddedProperty (True|False) "False" >

<!ELEMENT OriginalValue ( #PCDATA )>

<!ELEMENT NewValue ( #PCDATA )>

<!ELEMENT Hierarchy  (ObjectName, Hierarchy*) >
<!ATTLIST Hierarchy MicClass CDATA #REQUIRED>

<!ELEMENT ObjectName  ( #PCDATA ) >

<!ELEMENT Step (Obj,Details,Time,TimeTick* ,(Step|HtmlStep|Doc)*, DataMapping?, NodeArgs) >
<!ATTLIST Step rID ID #REQUIRED retval CDATA #IMPLIED>

<!ELEMENT HtmlStep (HTML,TimeTick*,(Step|HtmlStep|Doc)*,NodeArgs) >
<!ATTLIST HtmlStep rID ID #REQUIRED >

<!ELEMENT Obj ( #PCDATA ) >
<!ATTLIST Obj plainTxt (False|True) "True">

<!ELEMENT Details ( #PCDATA ) >
<!ATTLIST Details plainTxt (False|True) "True">

<!ELEMENT Time ( #PCDATA ) >

<!ELEMENT HTML ( #PCDATA ) >

<!ELEMENT Disp ( #PCDATA ) >

<!ELEMENT TimeTick ( #PCDATA ) >

<!ELEMENT DataMapping ( DataMappedItem* )>
<!ELEMENT DataMappedItem EMPTY >
<!ATTLIST DataMappedItem dsName CDATA #REQUIRED >
<!ATTLIST DataMappedItem rowId CDATA #REQUIRED >

<!ELEMENT NodeArgs (Disp,TopPane?,BtmPane?,ExtendedInfo? )>
<!ATTLIST NodeArgs eType CDATA #REQUIRED icon CDATA #REQUIRED nRep CDATA #REQUIRED UserNote CDATA #IMPLIED filter (False|True) "True">
<!ATTLIST NodeArgs status (Passed|Failed|Done|Warning|Information) "Done">
<!ATTLIST NodeArgs iconSel CDATA #IMPLIED nType CDATA #IMPLIED MovieMarker CDATA "">
<!ATTLIST NodeArgs Source CDATA #IMPLIED SourceLine CDATA #IMPLIED StepFlowItemKey CDATA #IMPLIED >

<!ELEMENT TopPane (Path)>

<!ELEMENT BtmPane ( (Path|WR)?,ASHilite?)>
<!ATTLIST BtmPane vType CDATA "HTML">

<!ELEMENT Path ( #PCDATA ) >

<!ELEMENT ASHilite ( #PCDATA ) >

<!ELEMENT WR ( #PCDATA ) >

<!ELEMENT ExtendedInfo ( StepData ) >

<!ATTLIST ExtendedInfo StepType CDATA #REQUIRED>
<!ELEMENT DT (NodeArgs) >
<!ATTLIST DT rID ID #REQUIRED>

<!ELEMENT Summary (Param*)>
<!ATTLIST Summary sTime CDATA #IMPLIED eTime CDATA #IMPLIED passed CDATA #IMPLIED failed CDATA #IMPLIED warnings CDATA #IMPLIED retval CDATA #IMPLIED stopped (False|True) "False" >

<!ELEMENT Param (ParamName,ParamVal)+ >
<!ATTLIST Param paramInOut (In|Out) "In">

<!ELEMENT ParamName ( #PCDATA ) >

<!ELEMENT ParamVal ( #PCDATA ) >

]
>
<Report ver="2.0" tmZone="Eastern Standard Time">
<General productName="HP Unified Functional Testing" productVer="12.02" os="Windows 7" host="IFSUFT-PC"><DocLocation><![CDATA[C:\Impact\Trunk_IFS_QuestionTypes\Drivers\SuiteDriver]]></DocLocation></General>
<Doc rID="T1"   productName= "HP Unified Functional Testing"  >
<DName><![CDATA[SuiteDriver]]></DName>
<Res><![CDATA[Res94]]></Res>
<DT rID="T2">
<NodeArgs eType="Table" icon="2" nRep="4" filter="False" >
<Disp><![CDATA[Run-Time Data Table]]></Disp>
<BtmPane vType="Table" >
<Path><![CDATA[Default.xls]]></Path>
</BtmPane>
</NodeArgs>
</DT>
<Action rID="T3">
<AName><![CDATA[Action1]]></AName>
<Step rID="T4">
<Obj plainTxt="False" ><![CDATA[SystemUtil]]></Obj>
<Details plainTxt="False" ><![CDATA[SystemUtil]]></Details>
<Time><![CDATA[12/23/2015 - 9:29:42]]></Time>
<TimeTick>1450880982</TimeTick>
<Step rID="T5">
<Obj plainTxt="False" ><![CDATA[Run "iexplore.exe",3]]></Obj>
<Details plainTxt="False" ><![CDATA[Run "iexplore.exe",3]]></Details>
<Time><![CDATA[12/23/2015 - 9:29:42]]></Time>
<TimeTick>1450880982</TimeTick>
<NodeArgs eType="Replay" icon="4" nRep="10" status="Passed" >
<Disp><![CDATA[Run "iexplore.exe",3]]></Disp>
</NodeArgs>
</Step>
<NodeArgs eType="Replay" icon="4" nRep="9" status="Passed" >
<Disp><![CDATA[SystemUtil]]></Disp>
</NodeArgs>
</Step>
<Step rID="T6">
<Obj plainTxt="False" ><![CDATA[Login]]></Obj>
<Details plainTxt="False" ><![CDATA[Browser]]></Details>
<Time><![CDATA[12/23/2015 - 9:29:52]]></Time>
<TimeTick>1450880992</TimeTick>
<Step rID="T7">
<Obj plainTxt="False" ><![CDATA[Login]]></Obj>
<Details plainTxt="False" ><![CDATA[Page]]></Details>
<Time><![CDATA[12/23/2015 - 9:29:52]]></Time>
<TimeTick>1450880992</TimeTick>
<Step rID="T8">
<Obj plainTxt="False" ><![CDATA[Login.Sync]]></Obj>
<Details plainTxt="False" ><![CDATA[]]></Details>
<Time><![CDATA[12/23/2015 - 9:29:52]]></Time>
<TimeTick>1450880992</TimeTick>
<NodeArgs eType="Replay" icon="6" nRep="15" >
<Disp><![CDATA[Login.Sync]]></Disp>
</NodeArgs>
</Step>
<NodeArgs eType="Context" icon="6" nRep="14" >
<Disp><![CDATA[Login]]></Disp>
</NodeArgs>
</Step>
<NodeArgs eType="Context" icon="5" nRep="13" >
<Disp><![CDATA[Login]]></Disp>
</NodeArgs>
</Step>
<Step rID="T9">
<Obj ><![CDATA[Login]]></Obj>
<Details ><![CDATA[]]></Details>
<Time><![CDATA[12/23/2015 - 9:29:52]]></Time>
<TimeTick>1450880992</TimeTick>
<NodeArgs eType="User" icon="7" nRep="16" status="Passed" >
<Disp><![CDATA[Login]]></Disp>
</NodeArgs>
</Step>
<Step rID="T10">
<Obj plainTxt="False" ><![CDATA[Login]]></Obj>
<Details plainTxt="False" ><![CDATA[Browser]]></Details>
<Time><![CDATA[12/23/2015 - 9:29:56]]></Time>
<TimeTick>1450880996</TimeTick>
<Step rID="T11">
<Obj plainTxt="False" ><![CDATA[Login]]></Obj>
<Details plainTxt="False" ><![CDATA[Page]]></Details>
<Time><![CDATA[12/23/2015 - 9:29:56]]></Time>
<TimeTick>1450880996</TimeTick>
<Step rID="T12">
<Obj plainTxt="False" ><![CDATA[TXT_user_name.Exist]]></Obj>
<Details plainTxt="False" ><![CDATA["Object exists"]]></Details>
<Time><![CDATA[12/23/2015 - 9:29:56]]></Time>
<TimeTick>1450880996</TimeTick>
<NodeArgs eType="Replay" icon="8" nRep="20" >
<Disp><![CDATA[TXT_user_name.Exist]]></Disp>
</NodeArgs>
</Step>
<Step rID="T13">
<Obj plainTxt="False" ><![CDATA[TXT_user_name.Set]]></Obj>
<Details plainTxt="False" ><![CDATA["chrisj"]]></Details>
<Time><![CDATA[12/23/2015 - 9:29:56]]></Time>
<TimeTick>1450880996</TimeTick>
<NodeArgs eType="Replay" icon="8" nRep="22" >
<Disp><![CDATA[TXT_user_name.Set]]></Disp>
</NodeArgs>
</Step>
<NodeArgs eType="Context" icon="6" nRep="19" >
<Disp><![CDATA[Login]]></Disp>
</NodeArgs>
</Step>
<NodeArgs eType="Context" icon="5" nRep="18" >
<Disp><![CDATA[Login]]></Disp>
</NodeArgs>
</Step>
<Step rID="T14">
<Obj ><![CDATA[Login]]></Obj>
<Details ><![CDATA[]]></Details>
<Time><![CDATA[12/23/2015 - 9:29:56]]></Time>
<TimeTick>1450880996</TimeTick>
<NodeArgs eType="User" icon="7" nRep="23" status="Passed" >
<Disp><![CDATA[Login]]></Disp>
</NodeArgs>
</Step>
<Step rID="T15">
<Obj plainTxt="False" ><![CDATA[Login]]></Obj>
<Details plainTxt="False" ><![CDATA[Browser]]></Details>
<Time><![CDATA[12/23/2015 - 9:29:59]]></Time>
<TimeTick>1450880999</TimeTick>
<Step rID="T16">
<Obj plainTxt="False" ><![CDATA[Login]]></Obj>
<Details plainTxt="False" ><![CDATA[Page]]></Details>
<Time><![CDATA[12/23/2015 - 9:29:59]]></Time>
<TimeTick>1450880999</TimeTick>
<Step rID="T17">
<Obj plainTxt="False" ><![CDATA[TXT_user_password.Exist]]></Obj>
<Details plainTxt="False" ><![CDATA["Object exists"]]></Details>
<Time><![CDATA[12/23/2015 - 9:29:59]]></Time>
<TimeTick>1450880999</TimeTick>
<NodeArgs eType="Replay" icon="8" nRep="27" >
<Disp><![CDATA[TXT_user_password.Exist]]></Disp>
</NodeArgs>
</Step>
<Step rID="T18">
<Obj plainTxt="False" ><![CDATA[TXT_user_password.Set]]></Obj>
<Details plainTxt="False" ><![CDATA["password"]]></Details>
<Time><![CDATA[12/23/2015 - 9:29:59]]></Time>
<TimeTick>1450880999</TimeTick>
<NodeArgs eType="Replay" icon="8" nRep="29" >
<Disp><![CDATA[TXT_user_password.Set]]></Disp>
</NodeArgs>
</Step>
<NodeArgs eType="Context" icon="6" nRep="26" >
<Disp><![CDATA[Login]]></Disp>
</NodeArgs>
</Step>
<NodeArgs eType="Context" icon="5" nRep="25" >
<Disp><![CDATA[Login]]></Disp>
</NodeArgs>
</Step>
<Step rID="T19">
<Obj ><![CDATA[Login]]></Obj>
<Details ><![CDATA[]]></Details>
<Time><![CDATA[12/23/2015 - 9:29:59]]></Time>
<TimeTick>1450880999</TimeTick>
<NodeArgs eType="User" icon="7" nRep="30" status="Passed" >
<Disp><![CDATA[Login]]></Disp>
</NodeArgs>
</Step>
<Step rID="T20">
<Obj plainTxt="False" ><![CDATA[Login]]></Obj>
<Details plainTxt="False" ><![CDATA[Browser]]></Details>
<Time><![CDATA[12/23/2015 - 9:30:02]]></Time>
<TimeTick>1450881002</TimeTick>
<Step rID="T21">
<Obj plainTxt="False" ><![CDATA[Login]]></Obj>
<Details plainTxt="False" ><![CDATA[Page]]></Details>
<Time><![CDATA[12/23/2015 - 9:30:02]]></Time>
<TimeTick>1450881002</TimeTick>
<Step rID="T22">
<Obj plainTxt="False" ><![CDATA[BTN_Log In.Exist]]></Obj>
<Details plainTxt="False" ><![CDATA["Object exists"]]></Details>
<Time><![CDATA[12/23/2015 - 9:30:02]]></Time>
<TimeTick>1450881002</TimeTick>
<NodeArgs eType="Replay" icon="9" nRep="34" >
<Disp><![CDATA[BTN_Log In.Exist]]></Disp>
</NodeArgs>
</Step>
<Step rID="T23">
<Obj plainTxt="False" ><![CDATA[BTN_Log In.Click]]></Obj>
<Details plainTxt="False" ><![CDATA[]]></Details>
<Time><![CDATA[12/23/2015 - 9:30:02]]></Time>
<TimeTick>1450881002</TimeTick>
<NodeArgs eType="Replay" icon="9" nRep="36" >
<Disp><![CDATA[BTN_Log In.Click]]></Disp>
</NodeArgs>
</Step>
<NodeArgs eType="Context" icon="6" nRep="33" >
<Disp><![CDATA[Login]]></Disp>
</NodeArgs>
</Step>
<NodeArgs eType="Context" icon="5" nRep="32" >
<Disp><![CDATA[Login]]></Disp>
</NodeArgs>
</Step>
<Step rID="T24">
<Obj ><![CDATA[Login]]></Obj>
<Details ><![CDATA[]]></Details>
<Time><![CDATA[12/23/2015 - 9:30:02]]></Time>
<TimeTick>1450881002</TimeTick>
<NodeArgs eType="User" icon="7" nRep="37" status="Passed" >
<Disp><![CDATA[Login]]></Disp>
</NodeArgs>
</Step>
<Step rID="T25">
<Obj plainTxt="False" ><![CDATA[Work Queue]]></Obj>
<Details plainTxt="False" ><![CDATA[Browser]]></Details>
<Time><![CDATA[12/23/2015 - 9:30:06]]></Time>
<TimeTick>1450881006</TimeTick>
<Step rID="T26">
<Obj plainTxt="False" ><![CDATA[Work Queue]]></Obj>
<Details plainTxt="False" ><![CDATA[Page]]></Details>
<Time><![CDATA[12/23/2015 - 9:30:06]]></Time>
<TimeTick>1450881006</TimeTick>
<Step rID="T27">
<Obj plainTxt="False" ><![CDATA[TAB _Home.Exist]]></Obj>
<Details plainTxt="False" ><![CDATA["Object exists"]]></Details>
<Time><![CDATA[12/23/2015 - 9:30:06]]></Time>
<TimeTick>1450881006</TimeTick>
<NodeArgs eType="Replay" icon="10" nRep="41" >
<Disp><![CDATA[TAB _Home.Exist]]></Disp>
</NodeArgs>
</Step>
<Step rID="T28">
<Obj plainTxt="False" ><![CDATA[Work Queue.Sync]]></Obj>
<Details plainTxt="False" ><![CDATA[]]></Details>
<Time><![CDATA[12/23/2015 - 9:30:06]]></Time>
<TimeTick>1450881006</TimeTick>
<NodeArgs eType="Replay" icon="6" nRep="43" >
<Disp><![CDATA[Work Queue.Sync]]></Disp>
</NodeArgs>
</Step>
<Step rID="T29">
<Obj plainTxt="False" ><![CDATA[TAB _Home.Exist]]></Obj>
<Details plainTxt="False" ><![CDATA["Object exists"]]></Details>
<Time><![CDATA[12/23/2015 - 9:30:11]]></Time>
<TimeTick>1450881011</TimeTick>
<NodeArgs eType="Replay" icon="10" nRep="45" >
<Disp><![CDATA[TAB _Home.Exist]]></Disp>
</NodeArgs>
</Step>
<NodeArgs eType="Context" icon="6" nRep="40" >
<Disp><![CDATA[Work Queue]]></Disp>
</NodeArgs>
</Step>
<NodeArgs eType="Context" icon="5" nRep="39" >
<Disp><![CDATA[Work Queue]]></Disp>
</NodeArgs>
</Step>
<Step rID="T30">
<Obj ><![CDATA[Login]]></Obj>
<Details ><![CDATA[]]></Details>
<Time><![CDATA[12/23/2015 - 9:30:14]]></Time>
<TimeTick>1450881014</TimeTick>
<NodeArgs eType="User" icon="7" nRep="46" status="Passed" >
<Disp><![CDATA[Login]]></Disp>
</NodeArgs>
</Step>
<Step rID="T31">
<Obj plainTxt="False" ><![CDATA[Work Queue]]></Obj>
<Details plainTxt="False" ><![CDATA[Browser]]></Details>
<Time><![CDATA[12/23/2015 - 9:30:24]]></Time>
<TimeTick>1450881024</TimeTick>
<Step rID="T32">
<Obj plainTxt="False" ><![CDATA[Work Queue]]></Obj>
<Details plainTxt="False" ><![CDATA[Page]]></Details>
<Time><![CDATA[12/23/2015 - 9:30:24]]></Time>
<TimeTick>1450881024</TimeTick>
<Step rID="T33">
<Obj plainTxt="False" ><![CDATA[TAB_Tests.Exist]]></Obj>
<Details plainTxt="False" ><![CDATA["Object exists"]]></Details>
<Time><![CDATA[12/23/2015 - 9:30:24]]></Time>
<TimeTick>1450881024</TimeTick>
<NodeArgs eType="Replay" icon="10" nRep="50" >
<Disp><![CDATA[TAB_Tests.Exist]]></Disp>
</NodeArgs>
</Step>
<Step rID="T34">
<Obj plainTxt="False" ><![CDATA[TAB_Tests.Click]]></Obj>
<Details plainTxt="False" ><![CDATA[]]></Details>
<Time><![CDATA[12/23/2015 - 9:30:24]]></Time>
<TimeTick>1450881024</TimeTick>
<NodeArgs eType="Replay" icon="10" nRep="52" >
<Disp><![CDATA[TAB_Tests.Click]]></Disp>
</NodeArgs>
</Step>
<NodeArgs eType="Context" icon="6" nRep="49" >
<Disp><![CDATA[Work Queue]]></Disp>
</NodeArgs>
</Step>
<NodeArgs eType="Context" icon="5" nRep="48" >
<Disp><![CDATA[Work Queue]]></Disp>
</NodeArgs>
</Step>
<Step rID="T35">
<Obj ><![CDATA[NavigateToDate]]></Obj>
<Details ><![CDATA[]]></Details>
<Time><![CDATA[12/23/2015 - 9:30:24]]></Time>
<TimeTick>1450881024</TimeTick>
<NodeArgs eType="User" icon="7" nRep="53" status="Passed" >
<Disp><![CDATA[NavigateToDate]]></Disp>
</NodeArgs>
</Step>
<Step rID="T36">
<Obj plainTxt="False" ><![CDATA[Work Queue]]></Obj>
<Details plainTxt="False" ><![CDATA[Browser]]></Details>
<Time><![CDATA[12/23/2015 - 9:30:27]]></Time>
<TimeTick>1450881027</TimeTick>
<Step rID="T37">
<Obj plainTxt="False" ><![CDATA[Work Queue]]></Obj>
<Details plainTxt="False" ><![CDATA[Page]]></Details>
<Time><![CDATA[12/23/2015 - 9:30:27]]></Time>
<TimeTick>1450881027</TimeTick>
<Step rID="T38">
<Obj plainTxt="False" ><![CDATA[LNK_Test Question Types.Exist]]></Obj>
<Details plainTxt="False" ><![CDATA["Object exists"]]></Details>
<Time><![CDATA[12/23/2015 - 9:30:27]]></Time>
<TimeTick>1450881027</TimeTick>
<NodeArgs eType="Replay" icon="10" nRep="57" >
<Disp><![CDATA[LNK_Test Question Types.Exist]]></Disp>
</NodeArgs>
</Step>
<Step rID="T39">
<Obj plainTxt="False" ><![CDATA[LNK_Test Question Types.Click]]></Obj>
<Details plainTxt="False" ><![CDATA[]]></Details>
<Time><![CDATA[12/23/2015 - 9:30:27]]></Time>
<TimeTick>1450881027</TimeTick>
<NodeArgs eType="Replay" icon="10" nRep="59" >
<Disp><![CDATA[LNK_Test Question Types.Click]]></Disp>
</NodeArgs>
</Step>
<NodeArgs eType="Context" icon="6" nRep="56" >
<Disp><![CDATA[Work Queue]]></Disp>
</NodeArgs>
</Step>
<NodeArgs eType="Context" icon="5" nRep="55" >
<Disp><![CDATA[Work Queue]]></Disp>
</NodeArgs>
</Step>
<Step rID="T40">
<Obj ><![CDATA[NavigateToDate]]></Obj>
<Details ><![CDATA[]]></Details>
<Time><![CDATA[12/23/2015 - 9:30:27]]></Time>
<TimeTick>1450881027</TimeTick>
<NodeArgs eType="User" icon="7" nRep="60" status="Passed" >
<Disp><![CDATA[NavigateToDate]]></Disp>
</NodeArgs>
</Step>
<Step rID="T41">
<Obj plainTxt="False" ><![CDATA[Navigation Page]]></Obj>
<Details plainTxt="False" ><![CDATA[Browser]]></Details>
<Time><![CDATA[12/23/2015 - 9:30:31]]></Time>
<TimeTick>1450881031</TimeTick>
<Step rID="T42">
<Obj plainTxt="False" ><![CDATA[Navigation Page]]></Obj>
<Details plainTxt="False" ><![CDATA[Page]]></Details>
<Time><![CDATA[12/23/2015 - 9:30:31]]></Time>
<TimeTick>1450881031</TimeTick>
<Step rID="T43">
<Obj plainTxt="False" ><![CDATA[DWL_Navigate through Service.Exist]]></Obj>
<Details plainTxt="False" ><![CDATA["Object exists"]]></Details>
<Time><![CDATA[12/23/2015 - 9:30:31]]></Time>
<TimeTick>1450881031</TimeTick>
<NodeArgs eType="Replay" icon="10" nRep="64" >
<Disp><![CDATA[DWL_Navigate through Service.Exist]]></Disp>
</NodeArgs>
</Step>
<Step rID="T44">
<Obj plainTxt="False" ><![CDATA[DWL_Navigate through Service.Object]]></Obj>
<Details plainTxt="False" ><![CDATA[]]></Details>
<Time><![CDATA[12/23/2015 - 9:30:31]]></Time>
<TimeTick>1450881031</TimeTick>
<NodeArgs eType="Replay" icon="10" nRep="65" >
<Disp><![CDATA[DWL_Navigate through Service.Object]]></Disp>
</NodeArgs>
</Step>
<Step rID="T45">
<Obj plainTxt="False" ><![CDATA[[ All Questions Combined ].Click]]></Obj>
<Details plainTxt="False" ><![CDATA[]]></Details>
<Time><![CDATA[12/23/2015 - 9:30:33]]></Time>
<TimeTick>1450881033</TimeTick>
<NodeArgs eType="Replay" icon="10" nRep="67" >
<Disp><![CDATA[[ All Questions Combined ].Click]]></Disp>
</NodeArgs>
</Step>
<Step rID="T46">
<Obj plainTxt="False" ><![CDATA[[ Date ].Click]]></Obj>
<Details plainTxt="False" ><![CDATA[]]></Details>
<Time><![CDATA[12/23/2015 - 9:30:36]]></Time>
<TimeTick>1450881036</TimeTick>
<NodeArgs eType="Replay" icon="10" nRep="69" >
<Disp><![CDATA[[ Date ].Click]]></Disp>
</NodeArgs>
</Step>
<NodeArgs eType="Context" icon="6" nRep="63" >
<Disp><![CDATA[Navigation Page]]></Disp>
</NodeArgs>
</Step>
<NodeArgs eType="Context" icon="5" nRep="62" >
<Disp><![CDATA[Navigation Page]]></Disp>
</NodeArgs>
</Step>
<Step rID="T47">
<Obj ><![CDATA[NavigateToDate]]></Obj>
<Details ><![CDATA[]]></Details>
<Time><![CDATA[12/23/2015 - 9:30:36]]></Time>
<TimeTick>1450881036</TimeTick>
<NodeArgs eType="User" icon="7" nRep="70" status="Passed" >
<Disp><![CDATA[NavigateToDate]]></Disp>
</NodeArgs>
</Step>
<Step rID="T48">
<Obj plainTxt="False" ><![CDATA[Navigation Page]]></Obj>
<Details plainTxt="False" ><![CDATA[Browser]]></Details>
<Time><![CDATA[12/23/2015 - 9:30:39]]></Time>
<TimeTick>1450881039</TimeTick>
<Step rID="T49">
<Obj plainTxt="False" ><![CDATA[Navigation Page]]></Obj>
<Details plainTxt="False" ><![CDATA[Page]]></Details>
<Time><![CDATA[12/23/2015 - 9:30:39]]></Time>
<TimeTick>1450881039</TimeTick>
<Step rID="T50">
<Obj plainTxt="False" ><![CDATA[BTN_Next.Exist]]></Obj>
<Details plainTxt="False" ><![CDATA["Object exists"]]></Details>
<Time><![CDATA[12/23/2015 - 9:30:39]]></Time>
<TimeTick>1450881039</TimeTick>
<NodeArgs eType="Replay" icon="9" nRep="74" >
<Disp><![CDATA[BTN_Next.Exist]]></Disp>
</NodeArgs>
</Step>
<Step rID="T51">
<Obj plainTxt="False" ><![CDATA[BTN_Next.Click]]></Obj>
<Details plainTxt="False" ><![CDATA[]]></Details>
<Time><![CDATA[12/23/2015 - 9:30:39]]></Time>
<TimeTick>1450881039</TimeTick>
<NodeArgs eType="Replay" icon="9" nRep="76" >
<Disp><![CDATA[BTN_Next.Click]]></Disp>
</NodeArgs>
</Step>
<NodeArgs eType="Context" icon="6" nRep="73" >
<Disp><![CDATA[Navigation Page]]></Disp>
</NodeArgs>
</Step>
<NodeArgs eType="Context" icon="5" nRep="72" >
<Disp><![CDATA[Navigation Page]]></Disp>
</NodeArgs>
</Step>
<Step rID="T52">
<Obj ><![CDATA[NavigateToDate]]></Obj>
<Details ><![CDATA[]]></Details>
<Time><![CDATA[12/23/2015 - 9:30:39]]></Time>
<TimeTick>1450881039</TimeTick>
<NodeArgs eType="User" icon="7" nRep="77" status="Passed" >
<Disp><![CDATA[NavigateToDate]]></Disp>
</NodeArgs>
</Step>
<Step rID="T53">
<Obj plainTxt="False" ><![CDATA[Dates]]></Obj>
<Details plainTxt="False" ><![CDATA[Browser]]></Details>
<Time><![CDATA[12/23/2015 - 9:30:43]]></Time>
<TimeTick>1450881043</TimeTick>
<Step rID="T54">
<Obj plainTxt="False" ><![CDATA[Dates]]></Obj>
<Details plainTxt="False" ><![CDATA[Page]]></Details>
<Time><![CDATA[12/23/2015 - 9:30:43]]></Time>
<TimeTick>1450881043</TimeTick>
<Step rID="T55">
<Obj plainTxt="False" ><![CDATA[LBL_Date.Exist]]></Obj>
<Details plainTxt="False" ><![CDATA["Object exists"]]></Details>
<Time><![CDATA[12/23/2015 - 9:30:43]]></Time>
<TimeTick>1450881043</TimeTick>
<NodeArgs eType="Replay" icon="10" nRep="81" >
<Disp><![CDATA[LBL_Date.Exist]]></Disp>
</NodeArgs>
</Step>
<Step rID="T56">
<Obj plainTxt="False" ><![CDATA[Dates.Sync]]></Obj>
<Details plainTxt="False" ><![CDATA[]]></Details>
<Time><![CDATA[12/23/2015 - 9:30:43]]></Time>
<TimeTick>1450881043</TimeTick>
<NodeArgs eType="Replay" icon="6" nRep="83" >
<Disp><![CDATA[Dates.Sync]]></Disp>
</NodeArgs>
</Step>
<Step rID="T57">
<Obj plainTxt="False" ><![CDATA[LBL_Date.Exist]]></Obj>
<Details plainTxt="False" ><![CDATA["Object exists"]]></Details>
<Time><![CDATA[12/23/2015 - 9:30:52]]></Time>
<TimeTick>1450881052</TimeTick>
<NodeArgs eType="Replay" icon="10" nRep="85" >
<Disp><![CDATA[LBL_Date.Exist]]></Disp>
</NodeArgs>
</Step>
<NodeArgs eType="Context" icon="6" nRep="80" >
<Disp><![CDATA[Dates]]></Disp>
</NodeArgs>
</Step>
<NodeArgs eType="Context" icon="5" nRep="79" >
<Disp><![CDATA[Dates]]></Disp>
</NodeArgs>
</Step>
<Step rID="T58">
<Obj ><![CDATA[NavigateToDate]]></Obj>
<Details ><![CDATA[]]></Details>
<Time><![CDATA[12/23/2015 - 9:30:52]]></Time>
<TimeTick>1450881052</TimeTick>
<NodeArgs eType="User" icon="7" nRep="86" status="Passed" >
<Disp><![CDATA[NavigateToDate]]></Disp>
</NodeArgs>
</Step>
<Step rID="T59">
<Obj plainTxt="False" ><![CDATA[Dates]]></Obj>
<Details plainTxt="False" ><![CDATA[Browser]]></Details>
<Time><![CDATA[12/23/2015 - 9:31:19]]></Time>
<TimeTick>1450881079</TimeTick>
<Step rID="T60">
<Obj plainTxt="False" ><![CDATA[Dates]]></Obj>
<Details plainTxt="False" ><![CDATA[Page]]></Details>
<Time><![CDATA[12/23/2015 - 9:31:19]]></Time>
<TimeTick>1450881079</TimeTick>
<Step rID="T61">
<Obj plainTxt="False" ><![CDATA[TXT_DateOneColoumnRequired.Exist]]></Obj>
<Details plainTxt="False" ><![CDATA["Object exists"]]></Details>
<Time><![CDATA[12/23/2015 - 9:31:19]]></Time>
<TimeTick>1450881079</TimeTick>
<NodeArgs eType="Replay" icon="8" nRep="90" Source="C:\Impact\Trunk_IFS_QuestionTypes\Libraries\GeneralLibraries\RegisteredFunctions.vbs" SourceLine="2290" >
<Disp><![CDATA[TXT_DateOneColoumnRequired.Exist]]></Disp>
</NodeArgs>
</Step>
<Step rID="T62">
<Obj plainTxt="False" ><![CDATA[TXT_DateOneColoumnRequired.Set]]></Obj>
<Details plainTxt="False" ><![CDATA["12/23/2015"]]></Details>
<Time><![CDATA[12/23/2015 - 9:31:19]]></Time>
<TimeTick>1450881079</TimeTick>
<NodeArgs eType="Replay" icon="8" nRep="92" Source="C:\Impact\Trunk_IFS_QuestionTypes\Libraries\GeneralLibraries\RegisteredFunctions.vbs" SourceLine="2290" >
<Disp><![CDATA[TXT_DateOneColoumnRequired.Set]]></Disp>
</NodeArgs>
</Step>
<NodeArgs eType="Context" icon="6" nRep="89" Source="C:\Impact\Trunk_IFS_QuestionTypes\Libraries\GeneralLibraries\RegisteredFunctions.vbs" SourceLine="2290" >
<Disp><![CDATA[Dates]]></Disp>
</NodeArgs>
</Step>
<NodeArgs eType="Context" icon="5" nRep="88" Source="C:\Impact\Trunk_IFS_QuestionTypes\Libraries\GeneralLibraries\RegisteredFunctions.vbs" SourceLine="2290" >
<Disp><![CDATA[Dates]]></Disp>
</NodeArgs>
</Step>
<Step rID="T63">
<Obj ><![CDATA[VerifyDateMonthDayMinTest1]]></Obj>
<Details ><![CDATA[]]></Details>
<Time><![CDATA[12/23/2015 - 9:31:19]]></Time>
<TimeTick>1450881079</TimeTick>
<NodeArgs eType="User" icon="7" nRep="93" status="Passed" Source="C:\Impact\Trunk_IFS_QuestionTypes\Libraries\GeneralLibraries\RegisteredFunctions.vbs" SourceLine="2290" >
<Disp><![CDATA[VerifyDateMonthDayMinTest1]]></Disp>
</NodeArgs>
</Step>
<Step rID="T64">
<Obj plainTxt="False" ><![CDATA[Dates]]></Obj>
<Details plainTxt="False" ><![CDATA[Browser]]></Details>
<Time><![CDATA[12/23/2015 - 9:31:22]]></Time>
<TimeTick>1450881082</TimeTick>
<Step rID="T65">
<Obj plainTxt="False" ><![CDATA[Dates]]></Obj>
<Details plainTxt="False" ><![CDATA[Page]]></Details>
<Time><![CDATA[12/23/2015 - 9:31:22]]></Time>
<TimeTick>1450881082</TimeTick>
<Step rID="T66">
<Obj plainTxt="False" ><![CDATA[TXT_DateOneColoumnRequired2.Exist]]></Obj>
<Details plainTxt="False" ><![CDATA["Object exists"]]></Details>
<Time><![CDATA[12/23/2015 - 9:31:22]]></Time>
<TimeTick>1450881082</TimeTick>
<NodeArgs eType="Replay" icon="8" nRep="97" Source="C:\Impact\Trunk_IFS_QuestionTypes\Libraries\GeneralLibraries\RegisteredFunctions.vbs" SourceLine="2290" >
<Disp><![CDATA[TXT_DateOneColoumnRequired2.Exist]]></Disp>
</NodeArgs>
</Step>
<Step rID="T67">
<Obj plainTxt="False" ><![CDATA[TXT_DateOneColoumnRequired2.Set]]></Obj>
<Details plainTxt="False" ><![CDATA["12/23/2015"]]></Details>
<Time><![CDATA[12/23/2015 - 9:31:22]]></Time>
<TimeTick>1450881082</TimeTick>
<NodeArgs eType="Replay" icon="8" nRep="99" Source="C:\Impact\Trunk_IFS_QuestionTypes\Libraries\GeneralLibraries\RegisteredFunctions.vbs" SourceLine="2290" >
<Disp><![CDATA[TXT_DateOneColoumnRequired2.Set]]></Disp>
</NodeArgs>
</Step>
<NodeArgs eType="Context" icon="6" nRep="96" Source="C:\Impact\Trunk_IFS_QuestionTypes\Libraries\GeneralLibraries\RegisteredFunctions.vbs" SourceLine="2290" >
<Disp><![CDATA[Dates]]></Disp>
</NodeArgs>
</Step>
<NodeArgs eType="Context" icon="5" nRep="95" Source="C:\Impact\Trunk_IFS_QuestionTypes\Libraries\GeneralLibraries\RegisteredFunctions.vbs" SourceLine="2290" >
<Disp><![CDATA[Dates]]></Disp>
</NodeArgs>
</Step>
<Step rID="T68">
<Obj ><![CDATA[VerifyDateMonthDayMinTest1]]></Obj>
<Details ><![CDATA[]]></Details>
<Time><![CDATA[12/23/2015 - 9:31:22]]></Time>
<TimeTick>1450881082</TimeTick>
<NodeArgs eType="User" icon="7" nRep="100" status="Passed" Source="C:\Impact\Trunk_IFS_QuestionTypes\Libraries\GeneralLibraries\RegisteredFunctions.vbs" SourceLine="2290" >
<Disp><![CDATA[VerifyDateMonthDayMinTest1]]></Disp>
</NodeArgs>
</Step>
<Step rID="T69">
<Obj plainTxt="False" ><![CDATA[Dates]]></Obj>
<Details plainTxt="False" ><![CDATA[Browser]]></Details>
<Time><![CDATA[12/23/2015 - 9:31:25]]></Time>
<TimeTick>1450881085</TimeTick>
<Step rID="T70">
<Obj plainTxt="False" ><![CDATA[Dates]]></Obj>
<Details plainTxt="False" ><![CDATA[Page]]></Details>
<Time><![CDATA[12/23/2015 - 9:31:25]]></Time>
<TimeTick>1450881085</TimeTick>
<Step rID="T71">
<Obj plainTxt="False" ><![CDATA[TXT_DateTwoColumnRequired.Exist]]></Obj>
<Details plainTxt="False" ><![CDATA["Object exists"]]></Details>
<Time><![CDATA[12/23/2015 - 9:31:25]]></Time>
<TimeTick>1450881085</TimeTick>
<NodeArgs eType="Replay" icon="8" nRep="104" Source="C:\Impact\Trunk_IFS_QuestionTypes\Libraries\GeneralLibraries\RegisteredFunctions.vbs" SourceLine="2290" >
<Disp><![CDATA[TXT_DateTwoColumnRequired.Exist]]></Disp>
</NodeArgs>
</Step>
<Step rID="T72">
<Obj plainTxt="False" ><![CDATA[TXT_DateTwoColumnRequired.Set]]></Obj>
<Details plainTxt="False" ><![CDATA["12/23/2015"]]></Details>
<Time><![CDATA[12/23/2015 - 9:31:25]]></Time>
<TimeTick>1450881085</TimeTick>
<NodeArgs eType="Replay" icon="8" nRep="106" Source="C:\Impact\Trunk_IFS_QuestionTypes\Libraries\GeneralLibraries\RegisteredFunctions.vbs" SourceLine="2290" >
<Disp><![CDATA[TXT_DateTwoColumnRequired.Set]]></Disp>
</NodeArgs>
</Step>
<NodeArgs eType="Context" icon="6" nRep="103" Source="C:\Impact\Trunk_IFS_QuestionTypes\Libraries\GeneralLibraries\RegisteredFunctions.vbs" SourceLine="2290" >
<Disp><![CDATA[Dates]]></Disp>
</NodeArgs>
</Step>
<NodeArgs eType="Context" icon="5" nRep="102" Source="C:\Impact\Trunk_IFS_QuestionTypes\Libraries\GeneralLibraries\RegisteredFunctions.vbs" SourceLine="2290" >
<Disp><![CDATA[Dates]]></Disp>
</NodeArgs>
</Step>
<Step rID="T73">
<Obj ><![CDATA[VerifyDateMonthDayMinTest1]]></Obj>
<Details ><![CDATA[]]></Details>
<Time><![CDATA[12/23/2015 - 9:31:25]]></Time>
<TimeTick>1450881085</TimeTick>
<NodeArgs eType="User" icon="7" nRep="107" status="Passed" Source="C:\Impact\Trunk_IFS_QuestionTypes\Libraries\GeneralLibraries\RegisteredFunctions.vbs" SourceLine="2290" >
<Disp><![CDATA[VerifyDateMonthDayMinTest1]]></Disp>
</NodeArgs>
</Step>
<Step rID="T74">
<Obj plainTxt="False" ><![CDATA[Dates]]></Obj>
<Details plainTxt="False" ><![CDATA[Browser]]></Details>
<Time><![CDATA[12/23/2015 - 9:31:29]]></Time>
<TimeTick>1450881089</TimeTick>
<Step rID="T75">
<Obj plainTxt="False" ><![CDATA[Dates]]></Obj>
<Details plainTxt="False" ><![CDATA[Page]]></Details>
<Time><![CDATA[12/23/2015 - 9:31:29]]></Time>
<TimeTick>1450881089</TimeTick>
<Step rID="T76">
<Obj plainTxt="False" ><![CDATA[TXT_DateMinMaxTestMaxSize1.Exist]]></Obj>
<Details plainTxt="False" ><![CDATA["Object exists"]]></Details>
<Time><![CDATA[12/23/2015 - 9:31:29]]></Time>
<TimeTick>1450881089</TimeTick>
<NodeArgs eType="Replay" icon="8" nRep="111" Source="C:\Impact\Trunk_IFS_QuestionTypes\Libraries\GeneralLibraries\RegisteredFunctions.vbs" SourceLine="2290" >
<Disp><![CDATA[TXT_DateMinMaxTestMaxSize1.Exist]]></Disp>
</NodeArgs>
</Step>
<Step rID="T77">
<Obj plainTxt="False" ><![CDATA[TXT_DateMinMaxTestMaxSize1.Set]]></Obj>